{
  "version": 2,
  "updated_at": "2026-10-11T01:45:00+00:00",
  "repos": [
    {
      "name": "analytics-service-toolkit",
      "owner": "nassim0014",
      "visibility": "public",
      "in_rotation": true,
      "role": "rotation",
      "created_by": "genesis-loop",
      "notes": "New to the registry as of 2026-08-21 — no prior-cycle notes yet. Read CLAUDE.md/README.md/docs/IMPROVEMENTS.md fresh. | Import-only shared toolkit consumed by other KINZ services — treat its public module surface as a contract; breaking changes ripple to sibling repos. | FLAG 2026-09-13 (closed-loop registry refresh): visibility found PUBLIC on GitHub, was recorded private as of 2026-09-10. This loop did not change it and does not know who/what did. Never fixed/reverted by this loop (visibility changes are owner-only) — surfaced in the run report for owner review. | 2026-09-27 (cloud-maintenance): quiet run, no open PRs, main green. | 2026-10-02 (cloud-maintenance): quiet run, no open PRs (dependabot or agent), main green (latest CI run #15 on commit 202f27b passed), ci.yml already runs on both push and pull_request so no new workflow needed. No action taken. Public visibility (previously flagged 2026-09-13) unchanged -- still an owner-only decision, not re-verified this run since no GitHub visibility-check tool was used, but nothing suggests it changed. | 2026-10-02 (cloud-improvements): worked backlog item 5 (Postgres-backed Deduplicator), split into 5a (library code -- done, PR #8, merged) and 5b (CI Postgres service-container wiring -- deferred, needs a .github/workflows/ edit this loop's merge rules keep as a separate owner-reviewed change, and there's no Postgres available in-sandbox to verify it against). PR #8 added a DedupBackend protocol, InMemoryDedupBackend, PostgresDedupBackend (atomic claim via INSERT ... ON CONFLICT ... RETURNING), and create_dedup_table; Deduplicator(ttl_s=...) stays backward-compatible. 15 new tests, coverage 91%->92%, ruff clean. CI (3.11/3.12) finished green after the subagent's run ended; the dispatcher polled it to completion and merged (sha 2c7df90). Next open items: 6 (astk doctor schema checks), 7 (repo hygiene parity), 8/9 (coverage-gap items), plus 4b and 5b (explicitly owner/future-cycle). | 2026-10-03 (cloud-maintenance): Checked fresh -- zero open PRs (dependabot or agent), nothing to merge/fix/close. Default branch main is green on CI run #20. Confirmed ci.yml already runs on both push and pull_request events (ruff + pytest, py3.11/3.12), so rule 5's new-workflow requirement is already satisfied and untouched. No action taken this cycle; item 5b (Postgres CI wiring, needs a workflow-file edit) remains deliberately deferred per prior run's note. | 2026-10-04 (cloud-maintenance): Checked fresh — zero open PRs (dependabot or agent), nothing to merge/fix/close. Default branch main is green on CI run 36998283384 (head 36e3f31, matches branch tip). Confirmed .github/workflows/ still contains only ci.yml, already running on both push and pull_request (ruff + pytest), so rule 5's new-workflow requirement remains satisfied and untouched. No action taken this cycle; deferred items 5b (Postgres CI service-container wiring) and others from 2026-10-02's cloud-improvements run remain open for a future cycle. | 2026-10-08 (cloud-maintenance): quiet run, zero open PRs, main CI green on run #20. ci.yml already covers push and pull_request so no workflow gap. Re-confirmed visibility still PUBLIC (unchanged since 2026-09-13 flag), owner-only decision, not touched. No action taken. | 2026-10-08 (cloud-daily-commit): no nassim0014 commit landed today, so added 3 tests for the previously-uncovered astk query CLI command (table/json/csv formats) -- closes the coverage gap in cli.py noted in #7. CI green (3.11/3.12), merged (PR #10, squash). cli.py coverage 80%->94%. | 2026-10-09 (cloud-maintenance): quiet run, zero open PRs, main CI green (run #22, success). | 2026-10-10 (cloud-creative): added astk demo, a zero-config/zero-secret CLI command exercising settings+db+alerts+dedup+logging end to end against in-memory SQLite (PR #11, merged). Judge subagent caught the demo settings subclass had silently widened slack_webhook_url from SecretStr to plain str -- fixed before merge, kept the real SecretStr type and added a dry-run SlackNotifier check for the unwrap-for-use path. 84 tests passing (was 77), ruff clean on 3.11/3.12.",
      "pushed_at": "2026-09-12T11:52:18Z",
      "primary_language": "Python",
      "is_archived": false,
      "worked_by": "claude"
    },
    {
      "name": "btc-llm-sentiment",
      "owner": "nassim0014",
      "visibility": "public",
      "in_rotation": true,
      "role": "rotation",
      "created_by": "manual",
      "notes": "No CLAUDE.md, no .claude/commands/improve.md. docs/IMPROVEMENTS.md is the backlog. | Lightweight CI test env (matches .github/workflows/ci.yml): pip install numpy pandas scikit-learn pytest pytest-cov ruff bandit — do NOT pip install -r requirements.txt for routine work, it pulls tensorflow/torch/transformers (ml-smoke job only). | Test: pytest tests/ -q --cov=src --cov-report=term-missing. Lint: ruff check src/ scripts/ tests/. SAST: bandit -r src/ scripts/ -ll -ii -x tests/. | As of 2026-08-21: ruff check has one PRE-EXISTING failure on main (unused pytest import in tests/test_phase1_display.py, F401) — filed as backlog item 7, confirmed via git stash to predate any loop change. Check if still present before assuming a lint failure is yours. | Backlog bookkeeping has rotted before: items 1 and 2 were merged (PR #23, #24) but never ticked off in docs/IMPROVEMENTS.md, and item 3 as literally written was already covered by existing tests. Verify a backlog item is actually still open in the code before doing the work it describes — grep for the described symptom first. | src/cv/walk_forward.py:evaluate_oof_metrics had a real bug (crashed on empty y_true instead of using its own n_days==0 fallback) masked by a self-skipping test — fixed 2026-08-21 (PR #33). A second, different shape-mismatch crash in the same function (len(y_prob) < len(rets)) is filed as item 8, NOT yet fixed. | has_ci: true (ci.yml has a lightweight test job + an ml-smoke job; sentiment_alert.yml is a separate scheduled workflow). | 2026-09-27 (cloud-maintenance): root-caused the 'don't chase' Docker build failure — Dockerfile's builder stage runs on Python 3.11 but requirements.txt pins shap==0.52.0 which needs Python>=3.12; reproduces identically on main. Separately, push-to-main's pip-audit --strict step fails with a real ResolutionImpossible across numpy/yfinance/pandas/transformers/tensorflow-cpu/scikit-learn/optuna/shap pins (advisory-only on PRs, blocking on main pushes). Both need a deliberate re-pin PR verified against the actual heavy ML stack, not a lightweight-CI fix. Dependabot PR #55 (pip group bump) was rebased onto main via update_pull_request_branch (cleared 2 of 3 red checks) but stays unmergeable on the Docker check until the Python-version mismatch is fixed. | 2026-10-01 (cloud-maintenance): the github MCP list_pull_requests tool wrongly returned an empty list for this repo this run — the REST API showed 5 open dependabot PRs (#63 numpy 1.26.4->2.5.3, #62 pyarrow, #61 torch 2.4.1->2.14.0, #60 yfinance 0.2.40->1.7.0, #55 pip group bump). Future runs: cross-check against REST if the MCP tool reports zero unexpectedly. All 5 fail the same pre-existing 'Docker build' check (shap==0.52.0 needs Python>=3.12, Dockerfile builds on 3.11 by ARG default) documented 2026-09-27. Tested the obvious one-line fix (bump ARG PYTHON_VERSION to 3.12) for real this time: created a Python 3.12 venv and ran `pip install -r requirements.txt` directly — it fails with ResolutionImpossible, independent of Docker: numpy==1.26.4 is pinned but shap==0.52.0 requires numpy>=2, and tensorflow-cpu/pandas/scikit-learn/optuna also float against whichever numpy wins. Reverted the Dockerfile edit (never committed). Confirms 2026-09-27's call: this needs a coordinated re-pin across numpy/shap/tensorflow-cpu/pandas/scikit-learn/optuna/torch/yfinance verified against the real heavy ML stack, not a single-line change — still not attempted. Left all 5 PRs open. | 2026-10-02 (cloud-maintenance): re-confirmed the 2026-09-27/2026-10-01 diagnosis with no new findings -- all 5 open dependabot PRs (#55, #60, #61, #62, #63) fail only the Docker build check; read #63's actual build log to confirm it's the identical Python-version conflict (numpy/shap need >=3.12, Dockerfile pins 3.11), not a new issue. Default branch main has been CI-red since 2026-09-23 for the same reason. Left all 5 PRs open and did not reattempt the Dockerfile ARG bump (confirmed twice already to cascade into a numpy/shap ResolutionImpossible on 3.12). A coordinated requirements re-pin (numpy/shap/tensorflow-cpu/pandas/scikit-learn/optuna/torch/yfinance) verified against the real heavy ML stack is still the only real fix and still has not been attempted by any run -- the right next pick for a dedicated (non-maintenance) session with a longer time budget. Also: #55 additionally fails github-advanced-security/CodeQL independent of the Docker issue, not yet root-caused (low priority). | 2026-10-03 (cloud-maintenance): 0 open PRs -- the 5 dependabot PRs from the last run were closed by the human owner directly (2026-10-02T10:58:19Z), not by automation. main CI still red on the previously-diagnosed unresolvable shap/numpy/tensorflow-cpu dependency graph -- confirmed this now fails two independent CI jobs (Docker build AND Security scans/pip-audit --strict), same root cause, still requires a coordinated full-stack re-pin, out of scope for routine maintenance. No action taken; nothing mergeable is waiting. | 2026-10-04 (cloud-maintenance): 0 open PRs (re-confirmed via REST API directly, matching 2026-10-03's state) — no action needed, nothing mergeable waiting. Re-confirmed main is still CI-red on the same previously-diagnosed root cause: Docker bui